{
  "$schema": "https://json-schema.org/draft/2020-12/schema",
  "$id": "https://nutriapp.internal/schemas/fasting_window_started.v1.json",
  "title": "FastingWindowStarted",
  "type": "object",
  "required": ["event_id", "aggregate_id", "event_type", "version", "occurred_at", "payload", "metadata"],
  "properties": {
    "event_id": { "type": "string", "format": "uuid" },
    "aggregate_id": { "type": "string", "format": "uuid", "description": "The user_id -- FastingWindow is a per-user aggregate." },
    "event_type": { "const": "FastingWindowStarted" },
    "version": { "const": 1 },
    "occurred_at": { "type": "string", "format": "date-time" },
    "payload": {
      "type": "object",
      "required": ["window_id", "user_id", "started_at"],
      "properties": {
        "window_id": { "type": "string", "format": "uuid" },
        "user_id": { "type": "string", "format": "uuid" },
        "started_at": { "type": "string", "format": "date-time" }
      },
      "additionalProperties": false
    },
    "metadata": {
      "type": "object",
      "required": ["correlation_id"],
      "properties": {
        "correlation_id": { "type": "string" },
        "causation_id": { "type": ["string", "null"] },
        "user_id": { "type": ["string", "null"] }
      },
      "additionalProperties": false
    }
  },
  "additionalProperties": false
}
