{
  "event_id": "55555555-5555-5555-5555-555555555551",
  "aggregate_id": "22222222-2222-2222-2222-222222222222",
  "event_type": "FastingWindowStarted",
  "version": 1,
  "occurred_at": "2026-08-28T09:00:00+00:00",
  "payload": {
    "window_id": "66666666-6666-6666-6666-666666666661",
    "user_id": "22222222-2222-2222-2222-222222222222",
    "started_at": "2026-08-28T09:00:00+00:00"
  },
  "metadata": {
    "correlation_id": "77777777-7777-7777-7777-777777777771",
    "causation_id": "77777777-7777-7777-7777-777777777771",
    "user_id": "22222222-2222-2222-2222-222222222222"
  }
}

